{
  "schema": "Mektup/1",
  "message-id": "msg_0198f0e0-0000-7000-8000-000000000007",
  "kind": "reply",
  "from-endpoint-id": "ep_0198f0e0-0000-7000-8000-000000000002",
  "from": "codex://devbox/thread/thread-recipient-001",
  "from-kind": "agent",
  "from-herdr": null,
  "to-endpoint-id": "ep_0198f0e0-0000-7000-8000-000000000001",
  "to": "codex://local/thread/thread-local-001",
  "requested-target": "codex://local/thread/thread-local-001",
  "in-reply-to": "msg_0198f0e0-0000-7000-8000-000000000003",
  "reply-requested": false,
  "reply-endpoint-id": null,
  "reply-to": null,
  "reply-custody-endpoint-id": null,
  "reply-custody-store-id": null,
  "sent-at": "2026-09-15T03:00:01.000000Z",
  "payload-bytes": 15,
  "payload-sha256": "sha256:914b169093c4dd7ec24080529845bb0660de553a835a200852e86c145470967f",
  "provenance": "observed",
  "reply-status": "success"
}
